{
  "$schema": "../metadata/performance-budgets.schema.json",
  "schemaVersion": 1,
  "version": "2.2.0",
  "assembly": {
    "bytes": 1200000
  },
  "staticAssets": {
    "bytes": 17200000
  },
  "entrypoints": {
    "css": {
      "bytes": 1970000,
      "gzipBytes": 275000
    },
    "runtime": {
      "bytes": 276000,
      "gzipBytes": 77500
    },
    "blazor": {
      "bytes": 12000,
      "gzipBytes": 4000
    }
  },
  "package": {
    "bytes": 6000000,
    "files": 180
  },
  "generatedSource": {
    "bytes": 900000
  }
}
